entity_id,longform
radharani,"[{""h"": ""Высшая энергия наслаждения"", ""p"": [""Шримати Радхарани — олицетворение хладини-шакти, внутренней энергии наслаждения Самого Кришны. Она — Его лучшая половина, источник всей Его радости и сладости."", ""Любовь Радхи к Кришне — это махабхава, высшая ступень чистой любви, недостижимая ни для кого другого.""], ""cite"": [{""ref"": ""Ч.-ч., Ади 4"", ""to"": ""/book/cc/adi/4""}], ""see"": [{""id"": ""krishna"", ""t"": ""Кришна""}]}, {""h"": ""Дочь Вришабхану"", ""p"": [""Шримати Радхарани явилась в Барсане как дочь царя Вришабхану и Киртиды; Её нашли сияющей на лотосе у Ямуны."", ""С детства Она — средоточие любви всего Враджа.""], ""see"": [{""id"": ""vrishabhanu"", ""t"": ""Махараджа Вришабхану""}, {""id"": ""kirtida"", ""t"": ""Киртида-деви""}, {""id"": ""barsana"", ""t"": ""Барсана""}]}, {""h"": ""Царица Вриндавана"", ""p"": [""Среди всех гопи Радхарани — первая; Вриндаван подчиняется Её настроению. Ближайшие подруги — Лалита и Вишакха — и юные служанки-манджари вечно служат Божественной Чете."", ""Лишь в настроении гопи, по их милости, можно войти в сокровенные игры Радхи и Кришны.""], ""see"": [{""id"": ""lalita"", ""t"": ""Лалита-деви""}, {""id"": ""vishakha"", ""t"": ""Вишакха-деви""}, {""id"": ""rupa-manjari"", ""t"": ""Рупа-манджари""}, {""id"": ""vrindavana"", ""t"": ""Вриндаван""}]}, {""h"": ""Радха и Кришна — одно"", ""p"": [""Радха и Кришна — единая Истина в двух телах, разделившаяся ради вкушения любви. Их воссоединение и есть высшая тайна гаудия-вайшнавизма."", ""Поклонение Радхе открывает доступ к Кришне, ибо Она — Его милость, явленная вовне.""], ""cite"": [{""ref"": ""Ч.-ч., Ади 4.55–56"", ""to"": ""/book/cc/adi/4/55""}], ""see"": [{""id"": ""krishna"", ""t"": ""Кришна""}]}, {""h"": ""Чайтанья — Кришна в настроении Радхи"", ""p"": [""Чтобы изведать величие любви Радхарани, Сам Кришна принял Её настроение и золотое сияние и явился как Шри Чайтанья Махапрабху."", ""Поэтому преданные взывают «Радхе Шьям»: путь начинается с предания Шримати Радхарани.""], ""cite"": [{""ref"": ""Ч.-ч., Ади 1.5"", ""to"": ""/book/cc/adi/1/5""}], ""see"": [{""id"": ""chaitanya"", ""t"": ""Шри Чайтанья Махапрабху""}]}]"
chaitanya,"[{""h"": ""Совместное явление Радхи и Кришны"", ""p"": [""Шри Чайтанья Махапрабху — Сам Кришна, принявший настроение и сияние Шримати Радхарани. Он — золотая аватара, юга-дхарма-аватара века Кали, давший людям совместное воспевание святых имён."", ""Внешне Он играл роль преданного, внутренне переживая любовь Радхи к Кришне.""], ""cite"": [{""ref"": ""Ч.-ч., Ади 1.5"", ""to"": ""/book/cc/adi/1/5""}, {""ref"": ""ШБ 11.5.32"", ""to"": ""/book/sb/11/5/32""}], ""see"": [{""id"": ""radharani"", ""t"": ""Шримати Радхарани""}, {""id"": ""krishna"", ""t"": ""Кришна""}, {""id"": ""nityananda"", ""t"": ""Нитьянанда""}, {""id"": ""advaita"", ""t"": ""Адвайта Ачарья""}]}, {""h"": ""Явление в Навадвипе"", ""p"": [""Махапрабху явился в Навадвипе в 1486 году, в семье Джаганнатхи Мишры и Шачидеви, и был назван Нимаем. Его рождение в полнолуние сопровождалось всеобщим воспеванием имени Хари."", ""С детства Он являл необычайные игры, пленяя сердца жителей Навадвипы.""], ""see"": [{""id"": ""navadvipa-dhama"", ""t"": ""Навадвипа-дхама""}, {""id"": ""advaita"", ""t"": ""Адвайта Ачарья""}]}, {""h"": ""Нимай Пандит и преображение в Гае"", ""p"": [""Юный Нимай прославился как непревзойдённый знаток грамматики и логики, основав свою школу. Но, придя в Гаю и получив посвящение от Ишвары Пури, Он преобразился: вспыхнула всепоглощающая любовь к Кришне."", ""С тех пор учёный логик стал «безумцем» от божественной любви.""], ""see"": [{""id"": ""ishvara-puri"", ""t"": ""Ишвара Пури""}, {""id"": ""gangadasa-pandit"", ""t"": ""Гангадаса Пандит""}]}, {""h"": ""Санкиртана в доме Шривасы"", ""p"": [""Вернувшись в Навадвипу, Махапрабху ночь за ночью вёл сокровенную санкиртану в доме Шривасы Тхакура вместе с Нитьянандой, Адвайтой и Гададхарой. Так пятеро — Панча-таттва — зажгли движение совместного воспевания."", ""Даже падшим Он раздавал чистую любовь к Богу.""], ""see"": [{""id"": ""srivasa"", ""t"": ""Шриваса Тхакур""}, {""id"": ""nityananda"", ""t"": ""Нитьянанда""}, {""id"": ""gadadhara"", ""t"": ""Гададхара Пандит""}]}, {""h"": ""Санньяса и Джаганнатха-Пури"", ""p"": [""В двадцать четыре года Махапрабху принял санньясу от Кешавы Бхарати и сделал Своей обителью Джаганнатха-Пури. Он совершил паломничество по Южной Индии, где встретил Рамананду Рая и раскрыл с ним высшие тайны любви."", ""Пури стало средоточием Его последующих игр.""], ""cite"": [{""ref"": ""Ч.-ч., Мадхья 7–9"", ""to"": ""/book/cc/madhya/7""}], ""see"": [{""id"": ""nilachala"", ""t"": ""Нилачала (Пури)""}, {""id"": ""ramananda-raya"", ""t"": ""Рамананда Рай""}]}, {""h"": ""Гамбхира — океан разлуки"", ""p"": [""Последние двенадцать лет Махапрабху провёл в Гамбхире, погружённый в настроение разлуки Радхи с Кришной. Рядом неотлучно были двое — Сварупа Дамодара и Рамананда Рай, утешавшие Его песнями об играх Божественной Четы."", ""В эти годы Он явил сокровеннейшие переживания чистой любви.""], ""cite"": [{""ref"": ""Ч.-ч., Антья 14–20"", ""to"": ""/book/cc/antya/14""}], ""see"": [{""id"": ""svarupa-damodara"", ""t"": ""Сварупа Дамодара""}, {""id"": ""ramananda-raya"", ""t"": ""Рамананда Рай""}, {""id"": ""gambhira"", ""t"": ""Гамбхира""}]}, {""h"": ""Наследие"", ""p"": [""Махапрабху послал шестерых Госвами во Вриндаван — восстановить святые места и изложить науку бхакти. Своё единственное письменное наследие Он оставил в восьми стихах «Шикшаштаки»."", ""Через Рупу Госвами Он продолжил Свою преемственность, дошедшую до Шрилы Прабхупады и ИСККОН.""], ""see"": [{""id"": ""rupa-goswami"", ""t"": ""Рупа Госвами""}, {""id"": ""sanatana-goswami"", ""t"": ""Санатана Госвами""}, {""id"": ""shikshashtaka"", ""t"": ""«Шикшаштака»""}]}]"
nityananda,"[{""h"": ""Проявление Баларамы"", ""p"": [""Господь Нитьянанда — это Сам Баларама, первая экспансия Кришны, явившийся как носитель милости Махапрабху. Он олицетворяет принцип духовного учителя и служения."", ""Без Его милости невозможно приблизиться к Шри Чайтанье.""], ""see"": [{""id"": ""balarama"", ""t"": ""Баларама""}, {""id"": ""chaitanya"", ""t"": ""Шри Чайтанья Махапрабху""}]}, {""h"": ""Авадхута Враджа"", ""p"": [""Явившись в Экачакре в Бенгалии, Нитьянанда долго странствовал как авадхута, скрывая Своё величие за обликом божественного безумца."", ""Встретив Махапрабху, Он стал Его неразлучным спутником.""]}, {""h"": ""Милость к падшим: Джагай и Мадхай"", ""p"": [""Нитьянанда вместе с Харидасом Тхакуром по велению Махапрабху ходил по домам Бенгалии, призывая всех воспевать имя Кришны. Когда грешные братья Джагай и Мадхай ранили Его, Он лишь молил о милости к ним — и они преобразились."", ""Так Он явил, что любовь Гауры доступна самым падшим.""], ""see"": [{""id"": ""haridasa-thakura"", ""t"": ""Харидас Тхакур""}, {""id"": ""chaitanya"", ""t"": ""Шри Чайтанья Махапрабху""}]}, {""h"": ""Семья и двадаша-гопалы"", ""p"": [""Супруги Нитьянанды — Джахнава и Васудха; Джахнава-деви после Его ухода стала почитаемой наставницей вайшнавов. Его сопровождали двенадцать пастушков (двадаша-гопал) — вечные спутники из Враджа."", ""Через Его линию преданность распространилась по всей Бенгалии.""], ""see"": [{""id"": ""jahnavi-devi"", ""t"": ""Джахнава-деви""}, {""id"": ""vasudha-devi"", ""t"": ""Васудха-деви""}, {""id"": ""uddharana-datta"", ""t"": ""Уддхарана Датта""}, {""id"": ""gauridasa-pandit"", ""t"": ""Гауридаса Пандит""}]}]"
advaita,"[{""h"": ""Проявление Маха-Вишну"", ""p"": [""Шри Адвайта Ачарья — проявление Маха-Вишну и Садашивы, почтенный вайшнав старшего поколения в Навадвипе."", ""Его положение неотлично от Господа, и всё же Он играл роль Его слуги.""], ""see"": [{""id"": ""chaitanya"", ""t"": ""Шри Чайтанья Махапрабху""}]}, {""h"": ""Призыв Господа"", ""p"": [""Скорбя о падшем веке Кали, Адвайта громко взывал к Кришне и подносил Ему листья туласи с водой Ганги, моля низойти. По Его зову Кришна явился как Шри Чайтанья Махапрабху."", ""Поэтому Его имя — Адвайта, «неотличный», и Ачарья, «учитель примером».""]}, {""h"": ""Сита Тхакурани и сыновья"", ""p"": [""Супруга Адвайты — Шримати Сита Тхакурани, питавшая к младенцу-Гауранге материнскую любовь и первой пришедшая благословить Его. Их сын Ачьютананда с детства был верен Махапрабху."", ""Дом Адвайты в Шантипуре стал прибежищем преданных.""], ""see"": [{""id"": ""sita-advaita"", ""t"": ""Сита Тхакурани""}, {""id"": ""achyutananda"", ""t"": ""Ачьютананда""}]}]"
gadadhara,"[{""h"": ""Олицетворение энергии наслаждения"", ""p"": [""Шри Гададхара Пандит почитается как проявление внутренней энергии наслаждения Господа — начала Шримати Радхарани в Гауранга-лиле."", ""Его любовь к Махапрабху была неотлучной с самого детства.""], ""see"": [{""id"": ""radharani"", ""t"": ""Шримати Радхарани""}, {""id"": ""chaitanya"", ""t"": ""Шри Чайтанья Махапрабху""}]}, {""h"": ""Друг детства и ученик Пундарики"", ""p"": [""Гададхара рос рядом с Нимаем в Навадвипе и был Его ближайшим другом. Его духовным наставником стал Пундарика Видьянидхи."", ""Где бы ни был Махапрабху, Гададхара стремился быть подле Него.""], ""see"": [{""id"": ""pundarika-vidyanidhi"", ""t"": ""Пундарика Видьянидхи""}]}, {""h"": ""Служение Тота-Гопинатхе"", ""p"": [""В Джаганнатха-Пури Гададхара поклонялся Божеству Гопинатхи (Тота-Гопинатха), не желая разлучаться с Махапрабху."", ""Он явил образец чистой преданности в настроении служения.""], ""see"": [{""id"": ""nilachala"", ""t"": ""Нилачала (Пури)""}]}]"
srivasa,"[{""h"": ""Проявление Нарады Муни"", ""p"": [""Шрила Шриваса Тхакур — проявление Нарады Муни, вечного проповедника преданности. Он — один из пяти членов Панча-таттвы."", ""Его дом стал колыбелью движения санкиртаны.""], ""see"": [{""id"": ""narada"", ""t"": ""Нарада Муни""}, {""id"": ""chaitanya"", ""t"": ""Шри Чайтанья Махапрабху""}]}, {""h"": ""Дом санкиртаны"", ""p"": [""Ночь за ночью Махапрабху со спутниками вёл сокровенную санкиртану в доме Шривасы в Навадвипе, куда не допускались посторонние. Именно здесь Господь являл Свои сокровенные настроения."", ""Так зародилось движение совместного воспевания святых имён.""], ""see"": [{""id"": ""navadvipa-dhama"", ""t"": ""Навадвипа-дхама""}, {""id"": ""nityananda"", ""t"": ""Нитьянанда""}, {""id"": ""advaita"", ""t"": ""Адвайта Ачарья""}]}, {""h"": ""Непоколебимая вера"", ""p"": [""Однажды во время киртана в доме Шривасы скончался его сын, но Шриваса не позволил прервать воспевание и не омрачил радость Господа своим горем."", ""Эта вера явила, что преданность выше любых мирских утрат.""]}]"
