entity_id,summary,biography,contribution,level
chaitanya,"Шри Чайтанья Махапрабху — совместное явление Радхи и Кришны, основоположник движения санкиртаны.","Шри Чайтанья Махапрабху явился в Навадвипе в 1486 году. Приняв санньясу в двадцать четыре года, Он распространял совместное воспевание святых имён по всей Индии и провёл последние годы в Джаганнатха-Пури, погружённый в настроение разлуки Шримати Радхарани.","Открыл людям века Кали юга-дхарму — санкиртану, совместное воспевание имён Кришны.",gold
nityananda,"Господь Нитьянанда — проявление Баларамы, носитель милости Махапрабху.","Господь Нитьянанда явился в Экачакре в Бенгалии и стал ближайшим спутником Шри Чайтаньи. Вместе с Харидасом Тхакуром Он раздавал любовь к Богу по всей Бенгалии даже самым падшим, включая братьев Джагая и Мадхая.",Распространил санкиртану в Бенгалии и явил безграничную милость к падшим душам.,gold
advaita,"Шри Адвайта Ачарья — проявление Маха-Вишну, призвавший Господа явиться.","Шри Адвайта Ачарья, почтенный вайшнав старшего поколения, громкими молитвами и подношением листьев туласи с водой Ганги призвал Кришну низойти как Шри Чайтанья ради спасения века Кали.",Своими молитвами вызвал явление Шри Чайтаньи Махапрабху.,gold
gadadhara,Шри Гададхара Пандит — олицетворение внутренней энергии Господа.,"Шри Гададхара Пандит, спутник Махапрабху с детства, считается проявлением энергии наслаждения Господа. В Пури он служил Божеству Гопинатхи и был неразлучен с Чайтаньей.",Явил образец чистой преданности в настроении служения.,gold
srivasa,Шрила Шриваса Тхакур — проявление Нарады Муни.,В доме Шривасы Тхакура в Навадвипе Шри Чайтанья со спутниками ночами вёл сокровенную санкиртану. Шриваса считается проявлением Нарады Муни.,В его доме зародилось движение санкиртаны Махапрабху.,gold
rupa-goswami,Шрила Рупа Госвами — главный из шести Госвами Вриндавана.,"Шрила Рупа Госвами (XVI век) оставил высокий пост при дворе Бенгалии, встретив Шри Чайтанью в Рамакели и Праяге. По указанию Господа он вместе с братом Санатаной восстановил святые места Враджа и систематизировал науку преданности.",Изложил науку бхакти-расы в «Бхакти-расамрита-синдху» и «Уджжвала-ниламани».,gold
sanatana-goswami,"Шрила Санатана Госвами — старший из шести Госвами, наставник в самбандхе.","Шрила Санатана Госвами, старший брат Рупы, был первым министром в Бенгалии и оставил всё ради служения Махапрабху. Он восстанавливал святыни Враджа и составил руководства по вайшнавской жизни.",Дал «Брихад-Бхагаватамриту» и «Хари-бхакти-виласу» — основы вайшнавского знания и практики.,gold
jiva-goswami,Шрила Джива Госвами — величайший философ гаудия-вайшнавизма.,"Шрила Джива Госвами, племянник Рупы и Санатаны, систематизировал философию школы и основал во Вриндаване центр учёности, сохранив наследие Госвами для будущих поколений.",Создал «Шат-сандарбху» — философский свод гаудия-веданты.,gold
gopala-bhatta-goswami,Шрила Гопал Бхатта Госвами — один из шести Госвами Вриндавана.,"Шрила Гопал Бхатта Госвами родом из Южной Индии был благословлён Махапрабху во время Его паломничества. Он установил во Вриндаване Божество Радхараманы, проявившееся из шалаграма-шилы.",Заложил основу «Хари-бхакти-виласы» и установил служение Радхараману.,gold
raghunatha-bhatta-goswami,Шрила Рагхунатха Бхатта Госвами — один из шести Госвами.,"Шрила Рагхунатха Бхатта Госвами славился сладостным чтением «Шримад-Бхагаватам». Благословлённый Махапрабху, он провёл жизнь во Вриндаване в постоянном слушании и прославлении Господа.",Явил образец преданного чтения «Шримад-Бхагаватам».,gold
raghunatha-das-goswami,"Шрила Рагхунатха дас Госвами — образец отречения, прайоджана-ачарья.",Шрила Рагхунатха дас Госвами оставил огромное богатство ради служения Махапрабху. После ухода Господа он жил у Радха-кунды в строгом отречении и непрестанном бхаджане.,Явил высший идеал отречения и любви к Радха-кунде.,gold
krishnadasa-kaviraja,Шрила Кришнадас Кавираджа Госвами — автор «Чайтанья-чаритамриты».,По указанию вайшнавов Вриндавана и по милости Божества Мадана-моханы Шрила Кришнадас Кавираджа в преклонном возрасте написал «Шри Чайтанья-чаритамриту» — авторитетное жизнеописание и философское изложение учения Махапрабху.,Составил «Чайтанья-чаритамриту» — вершину гаудия-литературы.,gold
vrindavana-dasa-thakura,Шрила Вриндаван дас Тхакур — «Вьяса игр Чайтаньи».,Шрила Вриндаван дас Тхакур описал ранние игры Махапрабху в Навадвипе. За это его почитают как Вьясу игр Шри Чайтаньи.,Написал «Чайтанья-бхагавату» — первое крупное жизнеописание Господа.,gold
vishvanatha-chakravarti,Шрила Вишванатха Чакраварти Тхакур — выдающийся комментатор XVII–XVIII веков.,Шрила Вишванатха Чакраварти Тхакур защитил и углубил наследие Госвами в эпоху после них. Его комментарии и труды о бхакти и расе стали опорой традиции.,Дал «Мадхурья-кадамбини» и классические комментарии к «Бхагаватам» и «Гите».,gold
baladeva-vidyabhushana,Шрила Баладева Видьябхушана — защитник гаудия-веданты.,Шрила Баладева Видьябхушана отстоял право гаудия-вайшнавов на собственный комментарий к «Веданта-сутре». По вдохновению Божества Говиндаджи он составил «Говинда-бхашью».,Написал «Говинда-бхашью» — гаудия-комментарий к «Веданта-сутре».,gold
narottama-dasa-thakura,Шрила Нароттама дас Тхакур — поэт-святой гаудия-традиции.,Шрила Нароттама дас Тхакур вместе со Шринивасой Ачарьей и Шьяманандой распространял наследие Госвами в Бенгалии и Ориссе. Его бенгальские песни доныне поют преданные.,Создал молитвенные песни «Прартхана» и «Према-бхакти-чандрика».,gold
srinivasa-acharya,Шрила Шринивас Ачарья — проповедник наследия Госвами в Бенгалии.,"Шрила Шринивас Ачарья получил сокровища писаний Госвами и распространил их в Бенгалии, возродив движение Махапрабху среди следующего поколения.",Принёс книги Госвами Вриндавана в Бенгалию и проповедовал их.,gold
shyamananda-pandita,Шрила Шьямананда Прабху — проповедник в Ориссе.,"Шрила Шьямананда Прабху, спутник Шринивасы и Нароттамы, распространял гаудия-вайшнавизм в Ориссе и прославился особой милостью Шримати Радхарани.",Утвердил традицию Махапрабху в Ориссе.,gold
bhaktivinoda-thakura,Шрила Бхактивинода Тхакур (1838–1914) — родоначальник возрождения гаудия-вайшнавизма.,"Шрила Бхактивинода Тхакур, государственный судья и плодовитый автор, возродил чистое учение Махапрабху в XIX веке. Он установил место рождения Господа в Маяпуре и заложил основу всемирной проповеди.","Написал «Джайва-дхарму», «Харинама-чинтамани» и десятки трудов, возродивших традицию.",gold
gaurakishora-dasa-babaji,"Шрила Гауракишора дас Бабаджи (ок. 1838–1915) — отрешённый святой, гуру Бхактисиддханты.","Шрила Гауракишора дас Бабаджи, осознавший себя святой, жил в полном отречении и непрестанном воспевании святого имени. Он стал духовным учителем Бхактисиддханты Сарасвати.",Явил идеал чистого бхаджана и отречения.,gold
bhaktisiddhanta-sarasvati,Шрила Бхактисиддханта Сарасвати Тхакур (1874–1937) — основатель Гаудия-матха.,"Шрила Бхактисиддханта Сарасвати, сын Бхактивиноды, основал Гаудия-матх и открыл десятки храмов. Он соединил строгую преданность с динамичной проповедью и печатью книг.",Основал Гаудия-матх и вдохновил всемирную проповедь сознания Кришны.,gold
prabhupada,Шрила А. Ч. Бхактиведанта Свами Прабхупада (1896–1977) — ачарья-основатель ИСККОН.,По указанию своего гуру Бхактисиддханты Сарасвати Шрила Прабхупада в возрасте шестидесяти девяти лет отправился на Запад и в 1966 году основал ИСККОН. За двенадцать лет он перевёл и прокомментировал главные писания и распространил сознание Кришны по всему миру.,Основал ИСККОН и дал миру «Бхагавад-гиту как она есть» и «Шримад-Бхагаватам».,gold
krishna,"Кришна — изначальная Верховная Личность Бога, источник всех аватар.","Согласно «Шримад-Бхагаватам», Кришна — не аватара, а Сам источник всех воплощений (кришнас ту бхагаван свайам). Около пяти тысяч лет назад Он явил Свои игры во Врадже, Матхуре и Двараке и поведал миру «Бхагавад-гиту».",Источник всего сущего; поведал «Бхагавад-гиту» и явил вечные игры Враджа.,gold
radharani,Шримати Радхарани — внутренняя энергия наслаждения Кришны (хладини-шакти).,"Шримати Радхарани — олицетворение хладини-шакти, высшее проявление любви к Кришне и повелительница Вриндавана. Её настроение и сияние принял Шри Чайтанья Махапрабху.",Воплощает высшую любовь к Богу; Её настроение принял Шри Чайтанья.,gold
